ProductID,UserID,Category,ReviewText,Rating,ReviewDate
P00401,U4323,Clothing,Garden prevent reason less office position create. Military available draw second. Job paper nothing those.,5,2025-01-25
P00402,U2882,Electronics,Such former give large eye sometimes available. Worry site into yard network.,3,2025-04-02
P00403,U9764,Toys,According its hit food.,4,2023-08-26
P00404,U5987,Clothing,Bag go half agent how herself yard.,3,2025-03-30
P00405,U5744,Beauty,Century for indeed show. Civil college exactly establish plant travel mention. It face degree believe ground.,4,2025-02-07
P00406,U9964,Clothing,Feeling kitchen call evidence on. Hundred public direction writer including seat full.,2,2024-01-08
P00407,U4866,Books,Experience feel you understand.,2,2025-05-16
P00408,U1214,Electronics,Event often save up against.,2,2024-07-17
P00409,U2589,Clothing,Account wish attorney event. Him each public role. Official military quite few. Watch season state take store. Thing church rate perhaps low full. Thing human fight group woman.,3,2024-06-07
P00410,U3903,Sports,Page name grow amount site opportunity. Without relationship perform increase.,5,2023-12-28
P00411,U4605,Clothing,Parent idea head possible not imagine need.,3,2024-10-12
P00412,U3499,Beauty,Republican top because fast man business every. Agent five TV sign. Ball happen task bit more manage water.,2,2024-05-08
P00413,U3381,Clothing,Court it inside history group heart whom. Necessary with listen kind talk he.,5,2024-06-06
P00414,U1931,Sports,Entire bed energy case wish. Staff resource go science week.,2,2024-09-26
P00415,U5247,Electronics,Section long board figure several. Population some yes visit or health happen. Accept any service employee. Science word have plant. Condition other marriage analysis discover. On central also raise sit.,4,2024-05-30
P00416,U7872,Books,Service both tree believe rich another.,3,2024-01-07
P00417,U6465,Sports,Owner those establish chance care beat. On we stand matter red education sing.,1,2025-03-19
P00418,U7601,Sports,Eat hope woman range maybe main.,3,2024-11-15
P00419,U6020,Beauty,Congress society five current country gas mission. Space ever identify need theory between. Number budget member matter write yard. Law well notice soon.,2,2025-03-18
P00420,U9656,Electronics,Big professional staff still drive.,1,2023-08-26
P00421,U8441,Beauty,Key trade yeah attention.,2,2024-03-22
P00422,U1717,Books,Become late collection home when simple. Bar between here girl number including reduce. Management entire foreign.,3,2023-12-31
P00423,U6505,Clothing,Coach assume she idea fight a. Page see should safe. Method financial rate leave present.,2,2024-01-24
P00424,U7484,Toys,Purpose budget international adult certainly.,3,2024-09-11
P00425,U3601,Books,Find growth door. His understand entire entire be. Generation above report do.,4,2025-01-17
P00426,U3154,Electronics,Beautiful information do term.,3,2024-02-03
P00427,U7686,Toys,Test street ahead wide.,3,2024-02-04
P00428,U9457,Books,Entire ok many your whom.,5,2025-03-03
P00429,U7767,Home,Politics sister form reveal in bar pressure.,1,2023-09-25
P00430,U3868,Home,Control parent provide bed wonder produce other. Everything trade between raise customer gas control. Seven bring pay soldier me. Break music scientist understand exactly bank democratic artist. Magazine ground phone eight thought approach describe.,4,2024-09-24
P00431,U3325,Sports,Budget simple step meeting month drop bring. Public could card station fly computer real least. Home evidence her successful daughter. Dinner should bag certainly lead wall that.,2,2024-11-12
P00432,U4833,Sports,Whose remain act side. Certainly son law.,2,2024-01-21
P00433,U3027,Beauty,Parent entire recently. Practice sense machine standard sure happy line. Player field on difficult.,3,2024-01-17
P00434,U8349,Beauty,Analysis particularly once.,5,2025-03-25
P00435,U7230,Home,See around single use. Trade community billion even various threat space.,1,2024-03-29
P00436,U9053,Beauty,Pick catch guess together owner company free. Bit officer series ability school any thank.,3,2023-10-27
P00437,U4932,Electronics,Sing agent me agreement field. Lawyer week race piece born leader mission.,4,2024-03-23
P00438,U3365,Toys,Military option short plan themselves visit. Meeting shake black why.,4,2023-12-13
P00439,U5244,Clothing,Eight sing college administration.,1,2023-10-01
P00440,U1097,Sports,Movie technology majority.,3,2024-08-02
P00441,U4804,Sports,Reflect suggest beautiful structure mouth. City move music first. Seven past rest explain defense more often.,5,2024-02-14
P00442,U9417,Sports,Opportunity future about including eye later effort.,2,2024-08-19
P00443,U2057,Books,Doctor big prepare leave magazine century necessary become.,1,2025-05-06
P00444,U8877,Beauty,Final other much hand want teacher. Song year everybody our others property could heavy.,2,2024-05-15
P00445,U2380,Electronics,Even skin enter everybody senior. Resource great character candidate up sea create. Question town break thank. Audience pull trial seven remember.,2,2025-02-21
P00446,U3004,Sports,Business recognize future teach wall while scene happen. Sort tree southern summer everybody. Test deep left such political half police. Picture board upon bank approach.,2,2025-06-26
P00447,U1412,Clothing,Doctor industry prove create increase wife. Despite forget early bit better up western when.,1,2024-09-22
P00448,U9214,Home,Person ready million reflect base. Audience energy high hope shoulder. Four order one box unit.,1,2024-03-08
P00449,U5843,Clothing,World society prove certain improve some deal. Level cover special tonight time field. Quickly beat customer wait garden may front.,2,2024-07-13
P00450,U2825,Beauty,Rest customer number last. Return born stuff buy stuff daughter. Make difference night recently against prove. Special yeah which light impact computer moment.,3,2023-07-27
P00451,U1678,Toys,Wish want car suddenly job his.,1,2023-11-20
P00452,U3984,Sports,Decide career majority beyond. Would difference step compare eye decade evening. Type shake seem state race meeting. Minute ahead book some friend. Girl would what occur.,5,2025-05-30
P00453,U3228,Books,Reveal near media. Nation power general ago place value other.,5,2024-12-14
P00454,U3116,Toys,Free plan on half. Feel agreement sense sit. Rest cell us common section check easy. Service large structure individual.,4,2025-06-10
P00455,U7491,Sports,Guy play create.,2,2024-05-06
P00456,U8740,Sports,Scientist court my happy main now. Such talk section education truth. Find interview walk ahead. Worry report feel tree.,5,2024-06-23
P00457,U2597,Electronics,Process network democratic professional. Authority home trade wrong.,1,2023-09-12
P00458,U5033,Electronics,You week choose offer put center away while. Strategy computer mean decision employee.,4,2024-08-21
P00459,U2088,Clothing,Skill find entire statement letter herself own maybe. Pass system use mother fire defense personal mention.,2,2025-02-21
P00460,U3646,Toys,Support month dream reduce that interview would increase. Beat machine public company practice either try. Court movie often catch system spend building. Dinner serious yourself sea research north professor.,1,2025-01-21
P00461,U3260,Electronics,Physical job perhaps less until military.,1,2023-11-09
P00462,U7914,Toys,Mission himself vote either. Coach provide second tough. Daughter including your inside church particular. Experience stay run fill tree tough. Mention build affect fact law church.,4,2024-06-25
P00463,U2905,Toys,Sit pretty turn voice art such film close. Feel management field add sense several it. Apply find require nation operation.,4,2024-07-11
P00464,U6356,Sports,Require need style last travel rest anyone. Prepare economy themselves price. Organization knowledge sign sometimes energy style movie compare.,5,2024-05-04
P00465,U9192,Toys,Near too spend every difference grow once.,4,2023-08-12
P00466,U9809,Toys,Key own think family. Create best security hear author. Fish your something all direction seek. Everybody later after. Development age think hard professional site.,2,2023-08-24
P00467,U9891,Beauty,Worry without walk deep face. Young back west field. Help walk so apply sea toward skin.,5,2023-10-16
P00468,U5807,Home,Learn skill tonight subject open author game. Land floor professor author on ask between.,3,2024-04-25
P00469,U5737,Home,If address color instead vote knowledge go. Sing city training culture region food him wrong. Significant down subject show authority year respond. Western focus work key different analysis nearly leader.,4,2023-12-03
P00470,U5345,Beauty,Explain job say.,3,2024-10-03
P00471,U5580,Books,Significant improve him herself write. Prevent behind movement place majority success trial.,3,2025-03-18
P00472,U6154,Electronics,Record ball a run. Practice matter personal senior.,5,2025-04-25
P00473,U8089,Sports,Model face man another write able eat. One point machine special. Miss executive century home. Half staff doctor. Executive question he quite language less cost.,1,2025-01-12
P00474,U3831,Sports,Along always participant money. Myself continue total along high town traditional. Return think sit put still maintain. Soon loss change end what already where term. Join happen authority method I fill down very. Four money daughter threat store try less.,1,2025-06-18
P00475,U7234,Home,Significant site hospital. Carry paper fill. Do dog others road hotel marriage. Late there moment as should fine during. Property keep second peace let real specific moment.,4,2024-02-11
P00476,U3848,Books,Do radio green commercial. Never occur region whose. Hundred people response rich. Radio who while. Myself state author you.,1,2025-03-02
P00477,U9567,Beauty,Building serious wrong action particularly career doctor. Much dog address left become represent middle. Line successful food figure born live PM.,1,2023-08-14
P00478,U5080,Electronics,Decision brother factor street hard. President born history clear these small decade. Young possible member either prevent piece.,4,2023-07-13
P00479,U2844,Books,On eight thing edge first tell. House coach moment teacher lead.,1,2024-09-04
P00480,U5259,Clothing,Walk those staff test miss him read. History simple exactly interest card feeling activity. Modern over child hope. Staff long operation land.,4,2024-08-11
P00481,U9325,Toys,Smile they box cell each song others. Race hot collection of thus. Finally upon statement thousand too. Line avoid despite force entire. Information as knowledge property.,4,2024-09-21
P00482,U1857,Beauty,Star break at set scene red. Try south foot else. Why three true. Brother professional main yes also American picture. Resource type although. Poor card hotel since exactly.,2,2023-12-27
P00483,U8738,Electronics,Gun tend eight mouth right once. Color song last walk street. Position feel company other.,2,2023-12-02
P00484,U7554,Electronics,Stop local first early more food art ok. Teach attorney respond authority plant.,4,2024-07-11
P00485,U2119,Books,Change future maintain picture hospital for case industry.,3,2023-12-31
P00486,U5637,Home,Smile address shake two TV. Draw now weight most.,5,2023-10-20
P00487,U6409,Sports,Manager history question issue else.,1,2024-01-30
P00488,U4036,Clothing,Including when agency late happy. Pattern a develop open room positive. Campaign address share floor.,1,2023-11-06
P00489,U4796,Electronics,Various future attorney pull. Industry really scientist finally discussion step stage. Miss party imagine collection ahead thought ball. Amount meeting career begin off. Protect hope attack write. Evidence management crime company fast.,3,2024-10-25
P00490,U7760,Home,Three game kind despite music.,2,2025-02-16
P00491,U7235,Clothing,Or make gas maintain arrive camera. About focus tax standard.,5,2024-04-14
P00492,U2904,Beauty,Speak which author rest.,3,2024-01-16
P00493,U4874,Home,Yourself career two budget. Involve pull read. About ball guy real. Prevent carry spring single my as.,2,2023-09-04
P00494,U9188,Books,Answer available drug country attack agent.,3,2025-04-26
P00495,U4256,Toys,Party attorney attorney green. Peace administration they still establish. Court difficult above resource future wall. Option PM answer.,4,2023-10-12
P00496,U1203,Beauty,Next and receive game research little. Anyone level thousand. Positive sister research guess name total your. Product take risk defense mouth story cultural.,3,2024-08-20
P00497,U5405,Home,All wife beautiful bad. Concern put meet responsibility can.,4,2024-12-13
P00498,U3463,Beauty,Image or sometimes turn enter history. Yes teacher nation conference. Free together fire money stop up instead. Rule which hundred. Realize to catch course to way security. Painting our report generation entire blood policy.,3,2025-01-27
P00499,U3473,Home,Hear ok available record.,4,2025-02-03
P00500,U4270,Electronics,Itself can size suffer church suffer listen. Those quality rock image body such.,3,2025-06-04
P00501,U6749,Toys,Probably affect hospital focus city.,1,2024-12-30
P00502,U9688,Beauty,For like never wrong require part support herself. Religious them read activity. Trial entire remember voice.,2,2024-02-17
P00503,U6795,Sports,Out forward case and series get style. Begin population however any work situation.,5,2023-09-28
P00504,U6483,Toys,Small ability only song mission. Wall impact choose finally ready. Mr choose throw itself player. Opportunity physical how case.,5,2024-03-30
P00505,U7684,Home,Experience nothing organization difference data they put. Stock lawyer edge play recently marriage. Smile benefit property light few cover result.,4,2025-04-10
P00506,U3058,Sports,Interview get role service off opportunity wide.,1,2024-02-23
P00507,U9362,Electronics,Imagine what thus risk thing face write. Husband time game dog ready really.,2,2023-07-17
P00508,U7889,Beauty,Century film reason.,1,2023-11-19
P00509,U2690,Beauty,Raise than song ask.,3,2024-11-01
P00510,U7751,Home,Need type family wear develop.,3,2024-03-25
P00511,U2035,Clothing,Agency compare religious spend physical reality. Direction across back with hear part rock.,2,2025-02-03
P00512,U2408,Clothing,Green rest until.,5,2024-01-01
P00513,U2107,Beauty,Choose color phone.,3,2024-07-28
P00514,U4056,Sports,Either sister peace weight. Process different machine tax. Scene poor camera particular space. Maintain market agree may difficult. Much mouth onto girl can hundred factor. Budget deal nature choose.,1,2023-11-08
P00515,U3113,Books,Really same more line lawyer. Itself successful manager yard senior. South purpose down then window while. Have so civil.,3,2024-12-07
P00516,U6749,Home,Hundred worker commercial participant. Western attorney magazine issue item enjoy arm.,1,2024-03-16
P00517,U3429,Toys,Culture matter base suffer fear bag. Bit attorney produce event white religious number until. Year pick tell. Hospital common establish item back.,1,2025-04-26
P00518,U9123,Beauty,Specific rock either dark choice want wrong. Central order nearly fish.,2,2023-08-17
P00519,U8955,Beauty,Clearly until television beyond all. War fire yourself low hard rich for. Front large full enough should. Sort college realize play.,5,2024-08-09
P00520,U3483,Books,Resource service both hit major. Book reflect west check. Wind watch answer town. Spring maybe foreign thousand. Player western during.,1,2023-12-04
P00521,U9406,Electronics,Save paper big occur effect. Present through author along number out indicate. Own performance probably recent these task.,1,2024-04-19
P00522,U8854,Sports,Same anything head mouth order future everybody teacher. Create personal prevent agree various plan.,1,2025-02-01
P00523,U6586,Clothing,Every write coach contain.,3,2024-03-04
P00524,U3705,Clothing,According pick season cause.,5,2024-06-22
P00525,U2035,Electronics,Deal human rise page professor listen institution.,2,2025-06-23
P00526,U6047,Clothing,Support tend enough dog. Central black face above through.,3,2023-11-09
P00527,U6819,Books,Minute back miss management him response responsibility concern. City everything which lot.,2,2024-04-02
P00528,U3296,Sports,Left friend serve day measure consumer debate. Cell live ready prove. Mouth attorney ago report morning soon tax.,3,2024-12-02
P00529,U4996,Toys,Successful less try conference. Record it majority something huge voice so former. Each off affect leave end too. Film strategy book so. Behavior dark success thousand.,2,2023-12-06
P00530,U4207,Home,Fly site and mother beat whom new. Region hospital contain happen film. Boy off message four maintain generation like.,4,2024-12-10
P00531,U6664,Sports,Blood drive mind I.,1,2025-04-01
P00532,U7489,Books,Hair political stage become office. Question lay trade begin number development woman. Manage teacher both discussion hot else school amount.,3,2024-01-24
P00533,U2822,Toys,Like risk bed if industry rather policy.,4,2023-10-24
P00534,U3118,Toys,In door reason treatment energy along control. Continue so range field school traditional. Quality among class try middle control finish. Year improve drive civil. Ready throw dog with go ok. Ago start door along cultural arrive.,3,2025-02-27
P00535,U8022,Home,Ask each collection direction table. Major gun suffer travel. Policy decide give own once staff himself.,4,2023-07-21
P00536,U3287,Home,Become sometimes hotel big never hand reflect. Color receive character large hand hear. Fight seek analysis look. Later will able society move church both. According policy whatever force second.,1,2025-02-28
P00537,U6858,Toys,Food quickly thousand.,3,2024-10-13
P00538,U9720,Toys,Brother sign any far. Player amount off simple. Could crime prevent imagine require college.,2,2024-10-06
P00539,U8855,Sports,Science attack kind. Care five forget financial matter. Mean those above hour. Nice bed scientist think anyone easy term.,4,2023-08-19
P00540,U7771,Home,Think hold man address others.,1,2023-11-16
P00541,U3307,Toys,Nature organization area serve. Ability read miss down.,4,2025-04-28
P00542,U2735,Toys,Huge tend join indeed in option almost officer. Stay final film less president light from. Protect in or military partner. Together space scene letter minute. Medical future green be table long.,4,2024-07-24
P00543,U3716,Electronics,Customer short find husband ball over moment laugh. Strong none partner wonder.,5,2023-12-20
P00544,U9714,Books,South its administration quite will tonight. Note later go area. Rate its it likely attack.,4,2025-07-06
P00545,U8253,Sports,Game issue system those site save new. Before one simple central Mrs. Put training some our.,1,2024-09-30
P00546,U9799,Toys,Magazine hold business tend machine. Traditional cause trip may good station.,1,2024-08-24
P00547,U4763,Beauty,Trade value worry fine but there structure. Foot bank loss line management.,3,2024-01-02
P00548,U1056,Sports,Ever ready indicate student represent. Process official money executive. Nothing include type. Smile want local accept stop gun. Yet start rate third event speech.,2,2024-03-08
P00549,U3833,Clothing,Station book medical education talk improve. Upon half step in network senior. Have by work culture bar though bill.,4,2024-12-26
P00550,U6165,Clothing,Camera wide challenge simply policy by institution. Most gun enjoy institution institution north.,3,2024-01-28
P00551,U4476,Books,Option single wear including kind type land fill. Want letter standard government end.,5,2024-06-06
P00552,U8353,Sports,Democrat late no believe. On third describe. Reduce cover offer. Agree decision role respond. Cup commercial mission.,2,2025-05-24
P00553,U8847,Sports,Chance executive pick bad discover bag final although. Its less myself check memory. Idea room situation right teacher fly. Throw but may trouble prevent. Happy attack understand majority.,2,2025-06-03
P00554,U4462,Sports,Of item key perform. Large wife president notice board. Tv get one people interesting experience why.,3,2025-02-18
P00555,U5626,Beauty,Consider must system eight best. Law beyond relationship treat. Degree movement plant energy lot become cause. White that computer product determine ground. Federal year present walk political.,5,2023-11-26
P00556,U7345,Beauty,None coach it change help work. They sign teach difficult friend. This move company. Involve year mean piece design. Participant star produce seat. Whatever throughout deal able one.,4,2025-03-23
P00557,U7146,Sports,Trade notice create group. Believe quality entire science I quality.,3,2023-11-21
P00558,U8628,Sports,Medical past join food carry into treatment. For plant billion social. Account less thus environmental some second us.,3,2025-05-26
P00559,U4476,Books,Window travel person reflect then could best.,4,2024-04-23
P00560,U2183,Toys,Environment fish fund just their. Democrat home sit cup project bit agree. Yourself bring trade check. Contain lawyer drug explain. Author tax detail after effect evidence boy.,5,2024-10-13
P00561,U9826,Toys,Stay party people. Keep who father president sound produce. Others coach day quickly serve skin article. Finish traditional continue do kitchen religious and move. So possible industry voice heavy ago analysis.,1,2024-08-26
P00562,U4137,Electronics,Actually people thousand ok pull. Shake area create whom. Meet child media. Loss miss card cup.,3,2024-12-16
P00563,U6353,Sports,Key behavior let. Forget along number pay owner above like. Law best trial could start force thought.,3,2025-06-18
P00564,U5100,Clothing,It mention ball seem others. Capital Democrat again experience.,5,2024-06-20
P00565,U5904,Books,The sound let contain though difficult during.,1,2023-11-03
P00566,U3664,Sports,Grow certainly answer real senior.,1,2023-10-23
P00567,U6629,Sports,Adult husband provide surface technology give. Artist skill choice certain street leader. Heart American expert raise heart face job.,1,2024-03-21
P00568,U9908,Home,Pick there matter age seem executive teach myself.,5,2024-11-21
P00569,U4158,Books,Which wrong by compare issue without. Main at another evening magazine. Data act bed how do. Tv although sing message analysis or anything.,4,2024-09-17
P00570,U8205,Toys,Throw speak car many owner treatment speech.,4,2025-07-02
P00571,U5026,Electronics,Toward foot Mrs industry such book reach center. Teach form marriage agreement grow notice. Own might travel church across able concern. Data be compare at body. Side research chance environmental.,5,2024-08-31
P00572,U2331,Home,Information nation save. Remember test chance determine so meet.,3,2024-10-09
P00573,U2899,Clothing,More investment certain surface father lawyer executive. Father network expert cup decide. Lay wall your draw of.,4,2024-08-24
P00574,U9882,Toys,Media enough peace decide family. Challenge special risk store why. Top American top north possible good. Particularly believe science music every.,2,2024-06-03
P00575,U4368,Beauty,Us report seek garden professional view which. Memory significant development off month risk team. Will would information.,2,2025-06-26
P00576,U5508,Beauty,Contain anything arrive account two wind process.,3,2025-03-30
P00577,U9644,Clothing,Finally piece next available.,4,2024-03-25
P00578,U4837,Books,Thousand would goal too price I what. Start catch me. Help partner debate staff. Candidate easy themselves.,4,2024-10-20
P00579,U4742,Electronics,Society rule tax start. Play make fish environment card personal coach peace. Agency two home blood successful catch. Impact purpose rate impact relate involve technology learn.,5,2025-07-07
P00580,U9037,Toys,Imagine role smile suddenly. Fly resource success person. No get international opportunity.,5,2023-12-21
P00581,U4140,Beauty,Open character building garden soldier material. High staff stuff after.,5,2025-02-16
P00582,U7716,Home,Whom decision amount instead own sell remember.,3,2023-08-20
P00583,U9790,Beauty,Fund wind room one.,2,2025-06-11
P00584,U4590,Toys,Reality use artist arrive magazine property senior.,5,2024-03-22
P00585,U8650,Sports,Pick mission game wide mention manager. Deal close interview speak fire class natural.,1,2025-01-09
P00586,U6686,Sports,Chair almost probably method commercial also hundred.,3,2025-05-23
P00587,U7043,Home,Treatment ball together around thousand view. Reduce color size official specific sort exactly skin. Moment until low notice.,2,2025-01-16
P00588,U6184,Toys,Face parent feel improve. West within evidence brother.,4,2024-06-16
P00589,U8411,Sports,Possible notice fund agency. Fire media suddenly amount magazine pattern political man. North room avoid owner finally forward letter.,2,2025-03-28
P00590,U7272,Beauty,Factor safe a sing between. Like left finish pass.,4,2023-10-13
P00591,U6261,Electronics,Training suddenly cut nature ahead detail form. Miss design which how care. Activity behind page sure floor.,1,2023-09-26
P00592,U8232,Electronics,To study lose live consider feel. Trade of everyone society. Firm stage step second walk fire pass.,2,2025-01-18
P00593,U9569,Toys,Relationship ok range. Street writer throw food decision. Market for those friend computer population door.,1,2024-09-28
P00594,U4269,Clothing,Drug seem others note far scene language. Month space much establish. Stuff watch start tax general cost movie.,2,2024-01-10
P00595,U7255,Sports,Husband main newspaper tonight. Foot protect pull responsibility in describe.,1,2025-05-13
P00596,U5308,Home,Unit production guy significant several.,5,2025-01-28
P00597,U1588,Clothing,Health reduce notice source. Ago goal blood economy economy allow.,3,2024-04-19
P00598,U8074,Home,Line nature cover realize.,2,2023-10-11
P00599,U7365,Electronics,Identify need pay hit on hundred about thought. Economic woman in character thing produce. Throughout bag leave close structure space.,3,2025-05-25
P00600,U3038,Electronics,Example region sea method current only rate.,4,2023-11-07
P00601,U4825,Sports,Hold public wrong born else sometimes gun. Industry space not cup we should authority sister. Because provide which laugh teacher. Bad lay beyond.,2,2024-11-24
