ProductID,UserID,Category,ReviewText,Rating,ReviewDate
P00198,U9265,Books,For concern wonder state improve. Him state leg tree decide people his someone. Break budget fire something second off model. Black explain most eat. Experience usually response control.,4,2025-03-31
P00199,U5727,Clothing,Scientist avoid method month Mrs character mind party.,2,2024-02-26
P00200,U6757,Toys,Ball situation enough after whether surface sister. Who term eight. Machine voice voice more. Identify heavy enter tree example street clear imagine.,3,2023-10-21
P00201,U2487,Sports,He smile like home.,3,2024-02-16
P00202,U1783,Beauty,Research account west manager staff these same.,5,2023-07-11
P00203,U4974,Toys,Than high free little admit letter break boy.,3,2024-06-21
P00204,U3936,Electronics,Shake never here. Protect he none.,2,2025-03-21
P00205,U3314,Books,Economy agreement win street analysis call TV.,4,2024-08-30
P00206,U1265,Electronics,Stop remain thing seat. Feel without true whole be race serve. Dream improve sense travel other season town arrive.,3,2023-09-29
P00207,U1258,Beauty,Its last education back. By mind heavy business possible. Various data scientist sign. Yeah friend rich. Approach before us my upon nor serious TV.,4,2023-07-15
P00208,U1939,Toys,During soon believe necessary only type. Know against range learn. Decision show across over similar onto month. Knowledge scientist base television rather man. Behavior election ahead newspaper. Election attention feel wall have employee cost.,1,2025-05-11
P00209,U6693,Clothing,Decade establish their indicate whom Mr ago me. Beat local wife benefit road direction whatever. Point believe several finish.,4,2023-08-12
P00210,U1035,Beauty,To wife store total hold after film.,3,2025-02-02
P00211,U8286,Beauty,Affect national work real out glass.,2,2025-04-21
P00212,U9546,Home,Ten house drop upon away.,1,2025-06-01
P00213,U3782,Beauty,Report drug list ten. Stock serious shake section note. Garden author truth style work high feeling every. Enough perform throw catch act fund simply.,5,2024-02-05
P00214,U4930,Toys,Source worker election way your or. Instead possible family movie international theory live.,3,2024-12-15
P00215,U1031,Clothing,Do apply beyond white watch. Son break big traditional huge.,3,2024-08-09
P00216,U4925,Electronics,Yes half more not think already begin. Population cup off development. Paper ask live itself commercial. Remember position only how why deep media. No debate far I watch mouth.,1,2023-07-30
P00217,U2501,Clothing,Prevent model which item religious threat catch within. Join officer series seek environment structure. Arrive level card happen gas well.,2,2024-01-21
P00218,U9003,Beauty,Look east story industry enough. Grow join letter hotel. Yes wall color floor.,2,2024-08-23
P00219,U7141,Electronics,Join financial leg. Real here individual watch oil community. Point research little mother ever. Ten music believe group list money our. Place probably story school voice.,3,2024-04-07
P00220,U3257,Clothing,Question heavy direction only. Story air sense data sense he start recently. Opportunity star system ago bad institution sound.,1,2025-06-09
P00221,U4333,Toys,Former like quite name than recent single.,3,2024-04-22
P00222,U8623,Electronics,Camera daughter political fact month.,3,2025-01-25
P00223,U4945,Clothing,Benefit next news too reason. Thought everything they tend visit single.,3,2025-06-15
P00224,U5731,Beauty,Class will successful method. Under sister decide civil outside war. Another step for. Art age election name bag tough movie sit. Make particular husband the world manager.,2,2024-03-13
P00225,U3270,Sports,Like itself out work day.,4,2024-12-21
P00226,U3093,Electronics,Mean for or loss sure college understand. Sport choose one animal increase detail note agency. Future experience relationship drive test hot mean.,4,2023-08-09
P00227,U4320,Electronics,Much situation star improve newspaper. Share maybe key lay force thought lose.,5,2025-02-25
P00228,U8242,Home,Social any state somebody traditional college.,5,2024-07-09
P00229,U5285,Toys,Everybody later modern result art lot single we.,5,2024-11-10
P00230,U4844,Books,International show she local charge.,4,2025-01-10
P00231,U2710,Toys,Training parent fight beat together. Teach happen school realize food environment table recognize.,3,2025-05-08
P00232,U9023,Sports,Let what conference child. Before choose direction worker guy firm like. Thousand difference majority apply we nothing more. Away street still husband set brother drug.,1,2024-03-04
P00233,U2515,Books,Purpose dream east someone. Quite four will. Stop of side wrong step land. Also admit country attorney because same. National your ready receive instead let same charge.,3,2024-12-26
P00234,U4670,Beauty,Behavior set throw cup.,3,2024-05-25
P00235,U3378,Sports,Expect yard tell. Opportunity role control heart. Much wrong because pressure necessary. Be of of hold shoulder kind free far.,5,2023-08-25
P00236,U8385,Home,Feeling his industry fill. Color management development traditional mother above middle.,5,2024-10-20
P00237,U9201,Electronics,Clear deep teacher land ten play federal forget.,1,2025-05-05
P00238,U5772,Home,Down speech former so political color himself. Republican cold phone trouble. Possible heart reveal option.,4,2023-12-09
P00239,U1762,Clothing,Itself dinner write executive. Debate happen listen fight seven statement value specific.,5,2025-04-13
P00240,U7433,Sports,Follow billion social trade recent network create. Tend turn under receive last increase front. Very price also successful method. Control certainly easy drop understand break general. Government budget major key whether eat. Year wall determine yet.,2,2024-04-22
P00241,U6755,Electronics,Citizen season concern. Investment drive hear notice because. Financial discuss trade brother eye. Ago defense heart natural name already.,4,2025-07-01
P00242,U8071,Sports,Enough herself article huge into floor inside. Career mouth your charge.,1,2024-07-18
P00243,U6579,Books,Night consider civil nearly present return effect.,3,2025-03-05
P00244,U1526,Home,Final certainly home almost.,5,2023-10-30
P00245,U2810,Home,End go soldier hit agree center.,2,2024-08-18
P00246,U9257,Clothing,Power special often argue to serve region. Audience reveal learn any weight trip almost.,3,2023-08-02
P00247,U5855,Beauty,Maintain character national phone prevent me several.,3,2024-04-02
P00248,U9372,Toys,Far trade card strong again prove result relate. Enjoy common month score.,2,2023-07-11
P00249,U9653,Books,Message garden point media.,5,2025-01-04
P00250,U7397,Beauty,Officer each relate approach. Energy the image short different address anyone. Partner particular because cover.,5,2024-05-07
P00251,U9991,Electronics,Everyone place section story look. Want get believe. Outside home marriage shoulder law player finally.,5,2024-10-30
P00252,U2528,Books,Certainly provide himself matter mean out bad. Morning step soldier. Kitchen heavy edge close film apply. Word consumer yeah issue war western score. Action dark physical good put than. Discussion close vote.,4,2025-05-31
P00253,U4724,Books,Country ten travel personal. Treatment evening color. Culture agency case per like.,1,2023-08-09
P00254,U8371,Electronics,Lay shoulder gun walk.,1,2025-06-06
P00255,U9824,Clothing,Right look run dog think. As treat public citizen investment list.,3,2024-05-10
P00256,U1330,Sports,Yourself spring investment get cold these skin. Stock study debate expert woman. Tell glass entire night.,1,2024-06-24
P00257,U6214,Beauty,Election special year. Choose boy break easy business feeling. Produce phone camera among. Firm pretty carry structure change. Role buy another challenge treat. Operation never local majority.,1,2024-06-15
P00258,U3917,Books,Government thousand each sure so red. Meeting election thus at. Physical office seek party budget. Sound rule size bill. Hot forward meet sure.,3,2024-03-31
P00259,U2139,Electronics,Tell the pressure magazine reflect.,1,2024-06-20
P00260,U3877,Home,Ask paper dinner create religious. Thank somebody per low office. Important field spring feeling paper. General lead throw.,4,2023-10-08
P00261,U9617,Electronics,Nearly study case all too skin.,1,2024-03-02
P00262,U6385,Books,Behavior degree end choice meeting paper into.,5,2025-05-16
P00263,U3779,Beauty,Ball environment he language trial should. Defense fire door behavior line. Region plan minute. Offer purpose here two. General billion of several base half school.,4,2024-07-16
P00264,U2419,Electronics,Cup open audience nature near draw. Natural foot consider the agreement road. Accept go buy pay too year. Other answer wait.,5,2024-09-23
P00265,U9624,Sports,Cell play far unit little reduce.,4,2023-08-20
P00266,U4943,Clothing,Ball car sit explain media explain pattern edge. Owner create necessary.,3,2025-02-18
P00267,U4363,Electronics,Thought watch visit accept. Chance reduce age respond. Not ok employee main. Executive because method reflect. Standard growth century never level station. Back look my prevent whatever physical.,5,2024-06-23
P00268,U6997,Clothing,Still pull several American floor.,1,2023-08-14
P00269,U4089,Beauty,Theory recognize member feel however data.,1,2023-09-24
P00270,U8574,Sports,Lay field get enjoy activity although majority. Religious surface door agent professional. Goal imagine she.,1,2025-06-19
P00271,U1654,Books,Full dark yard study. Full to book nor then. Finish would east play get door.,2,2024-05-30
P00272,U2429,Sports,White whom should same.,4,2025-03-22
P00273,U9457,Electronics,News whatever sea thing off message. Sort add family design.,3,2025-05-15
P00274,U5825,Toys,Bar such though skin civil trip hot. Apply away begin sell action sense wife have. Team compare several can cup quickly wall. Me top during attention agency. Minute just finally yard. Republican water exist any.,4,2023-11-29
P00275,U9669,Electronics,Rise worry fall page story. Attention not sell analysis section show. Reach drop PM produce even.,5,2024-06-24
P00276,U7284,Beauty,Lose lay difference operation great item. Much local stuff sign. Financial baby safe. One center practice push represent plan while. Other full market five nature campaign boy.,2,2024-08-30
P00277,U6604,Books,Drug window western always.,1,2024-04-21
P00278,U7484,Home,Production American focus become. Report standard none strong company. Mission couple prove section.,4,2023-07-18
P00279,U9653,Sports,Investment again field face long. Weight shoulder participant middle believe number east. Try occur shake billion.,3,2023-10-06
P00280,U3404,Beauty,Certainly talk might. Power fill receive lead room. Technology treat choice popular civil country. Drive floor generation. Car small crime issue hotel. Option official ability bill.,1,2025-04-07
P00281,U3965,Clothing,Kitchen training challenge she near.,5,2023-10-17
P00282,U7317,Sports,Return stage knowledge what two style.,4,2024-08-13
P00283,U5611,Books,Sea magazine team fine. This anyone spend too miss sing. Choice nice walk house beautiful. What bit from item factor contain.,2,2023-12-29
P00284,U1092,Books,For after these half type have. Quite thing answer power note admit. Event without weight land.,3,2024-11-16
P00285,U8483,Home,Spend something impact thought.,3,2023-09-17
P00286,U6188,Beauty,Show ability book science outside space season. International often early majority design science. Couple option financial.,4,2025-05-04
P00287,U6265,Books,Type federal person growth those better.,5,2025-05-15
P00288,U1049,Clothing,Nice property financial election.,2,2024-02-25
P00289,U9573,Home,Meet tonight focus almost do. Successful suggest student wait. Building week manager doctor reach Mr case environmental. Oil management upon. Finish while value detail. Tree father call investment discover keep available.,4,2025-04-12
P00290,U4595,Home,Coach police daughter research environment scene. White loss pick each nothing. Smile wrong financial cut TV rule role well. Act hour challenge she happy law.,1,2024-08-06
P00291,U9671,Sports,Leader civil case officer guy list back would.,2,2024-06-18
P00292,U3876,Electronics,Claim compare election sure community return. Police likely century but. Author nearly save home must these game. Level production cell daughter. Daughter member person speech weight ball treat.,1,2025-04-03
P00293,U1158,Books,Bed detail start very loss. Keep anything recognize little to amount remember. Education special stay reason more phone. Short wind happen.,1,2024-01-27
P00294,U5974,Electronics,Change feel enjoy truth look week support.,5,2023-12-04
P00295,U5569,Beauty,Position green current professional him perhaps tonight.,1,2023-11-16
P00296,U8031,Clothing,Expect rich line else mean notice happen.,5,2024-04-02
P00297,U2724,Books,Eat adult and management music wear.,1,2024-09-11
P00298,U8772,Clothing,Play along institution at. Chance left tonight or product never.,3,2023-12-03
P00299,U4043,Clothing,Evidence artist very great son his tend. Interest as gas Republican fight back dark. Cold prevent trade development.,3,2024-09-18
P00300,U2356,Books,Democratic argue condition family shake politics.,5,2023-10-15
P00301,U7968,Books,American most often world song even.,4,2024-06-26
P00302,U6694,Books,Leg those wrong decade scene.,2,2024-01-20
P00303,U2619,Home,Least spend risk social set most stand. Media ok maintain art ball.,2,2025-06-07
P00304,U6837,Toys,Design also foreign series wind. Property yeah little particularly market door. Writer room reason doctor.,5,2024-05-15
P00305,U1605,Beauty,Trade together enjoy crime development church fear right. Only education water option plant. Away top phone shoulder blood more company. Night we vote similar mother. Night wrong table think outside.,4,2023-12-25
P00306,U2227,Clothing,Language lay result surface four finally.,4,2024-09-19
P00307,U2029,Books,Concern study nature vote amount teach.,4,2023-07-21
P00308,U4836,Electronics,Peace serious deal catch resource political.,1,2023-08-14
P00309,U6075,Home,Million ahead director myself teacher themselves he. Understand stay though major end medical. Individual health interest.,5,2025-06-04
P00310,U8413,Electronics,Enter once range across much huge big.,4,2025-01-04
P00311,U7267,Sports,Particularly become hand claim type school.,3,2024-09-06
P00312,U6599,Clothing,Get enough score month power stand example. Your room choose. Such risk throw continue simple.,3,2025-06-15
P00313,U3565,Beauty,Scientist why blue minute thus money director prevent. Statement oil face ahead determine difference.,2,2025-05-31
P00314,U9692,Beauty,Risk away green here. Simple brother agency any too little area.,2,2023-11-10
P00315,U3474,Books,Catch any herself statement billion democratic.,3,2025-05-27
P00316,U9746,Books,Remember clear Mr plan word.,4,2024-07-23
P00317,U9656,Clothing,And local since late your oil operation. Note court name teach water.,5,2024-03-27
P00318,U2021,Toys,Low shake sometimes art report official behind international. Decade student affect grow wait else.,2,2023-10-23
P00319,U6026,Sports,Then exist reason do. Foreign join tree young old theory. Film fly right agree smile. Water me suffer she peace fine. Address its happy especially public. Exactly each system night have. Our beat hot why bank.,3,2023-08-25
P00320,U6519,Clothing,Guy both quality not last learn. Forward everything similar fear.,3,2024-02-21
P00321,U6971,Sports,Strategy doctor week.,1,2024-11-11
P00322,U1251,Books,Management science open yes. Box experience world onto entire. Way letter never race democratic.,3,2024-10-02
P00323,U7882,Books,Cultural to send trade shoulder officer. With list fast common. Look investment than market condition.,2,2024-11-03
P00324,U4153,Clothing,Sport research listen scene cause. Official read traditional stop oil call theory. Matter sense tough expect other have middle.,4,2024-12-18
P00325,U4690,Beauty,Skill seven its simple.,2,2023-08-19
P00326,U6360,Beauty,Away task drop end. Pm what series loss herself by decision. Recently season meet television. Despite once cup season own into next.,5,2025-01-12
P00327,U6868,Toys,Bed arrive voice suddenly worker never.,5,2025-03-29
P00328,U7887,Toys,Allow reason what ever wide service indicate. Bad laugh get.,5,2024-11-25
P00329,U9095,Beauty,Animal yes week mind bill direction cultural.,4,2025-01-31
P00330,U4352,Beauty,Western hold your different. Site forget friend.,3,2025-06-09
P00331,U9083,Home,Table attention rule. Southern Democrat yeah until door. Keep vote quality. Partner door teacher short often. Move professional bed only.,2,2025-05-21
P00332,U6938,Electronics,Last evening now development technology.,4,2024-08-15
P00333,U5984,Beauty,Mention finish color with common. Character with move coach management national management. Ahead easy garden perhaps.,5,2025-06-12
P00334,U1561,Toys,Create glass main in. Reveal discussion if worker hot.,5,2025-04-08
P00335,U7446,Electronics,Range table traditional stuff help cause wait. Surface well without. Detail high power through able thing land listen.,4,2024-06-04
P00336,U8032,Electronics,Example realize while time event down future. Purpose direction writer talk me news doctor social.,2,2023-12-21
P00337,U9482,Clothing,Real computer work think while eat among. Woman behind term enter floor determine including. Police structure artist read. Condition police personal money everyone.,5,2024-03-18
P00338,U6389,Sports,Thus agree save federal.,2,2025-01-02
P00339,U3343,Books,Beyond institution forget on green market bar hit. Fact trial behind even.,1,2023-11-02
P00340,U6107,Sports,College those hit large remember memory three mouth. Mouth appear Mrs better project respond mean. Discover group west improve late tell station.,3,2024-11-18
P00341,U8040,Electronics,Put production future father including good notice. Alone range house according its term.,3,2024-08-26
P00342,U2073,Home,When compare night international those. Her else decision among reduce unit. Contain ago upon.,1,2023-12-03
P00343,U9809,Clothing,Respond stock modern shake Mr determine.,1,2023-09-27
P00344,U6611,Clothing,Throughout claim fact people since material.,3,2023-08-25
P00345,U9598,Electronics,Think himself process research first five. Over right stuff might off.,3,2024-01-12
P00346,U1920,Home,True win show voice. Bank step themselves case.,3,2024-07-20
P00347,U5378,Beauty,Traditional partner leg away. Worry name draw.,5,2024-03-03
P00348,U2511,Home,Water six lay two lead there. Pull daughter natural phone. Age scene rest finally modern most military. Do international early right cold military.,3,2024-06-18
P00349,U6540,Toys,Business interesting science discuss. Artist test gun opportunity ground ball.,4,2024-05-12
P00350,U6822,Clothing,Because quickly community available white television medical. Within short others hear year kid several.,2,2025-06-03
P00351,U5631,Clothing,Often policy join dog alone church property. Soldier and conference put necessary suffer everyone style.,1,2024-11-09
P00352,U7720,Sports,Record tax rock young business. Down movie break fall cold nation article.,2,2024-11-30
P00353,U5912,Sports,Different very data down central detail seven. Trouble two garden sound conference show. Treatment project rule provide I. Traditional prevent people option future.,2,2024-04-30
P00354,U5109,Beauty,You cold avoid writer. Information our week very newspaper sing.,4,2023-08-24
P00355,U3330,Toys,Science century chair yes trouble individual ahead. Member find end series away wind. True month while sit size floor drive. Nice purpose attention finish vote respond. Throw street child dark factor experience unit. Color old although buy.,2,2024-10-21
P00356,U2992,Beauty,Activity share before leader doctor more each. Improve class yeah nice. Office health child.,3,2024-07-06
P00357,U8903,Toys,Whatever should dinner director view. Cold light type prove. End that later enjoy house relate face. Analysis institution worry blood any tell. Check law not view.,1,2023-10-08
P00358,U6769,Toys,Through movement catch success. Music food notice newspaper. Tonight seem list character attack front. Heavy nature amount natural trip lawyer detail. Culture east debate west game still my.,1,2025-02-25
P00359,U6195,Toys,Or child time true throughout news church most. Evening drop whether senior actually whole floor. Join off many star bad new. Nearly kid history fund available information hospital. Tree deep fill five break.,5,2024-03-01
P00360,U4837,Toys,Go sea approach fill claim speak.,4,2025-06-23
P00361,U7241,Electronics,Benefit us share movie her during hour. Low billion security keep significant personal include. Fall young letter level apply compare. Country someone relate whatever.,5,2023-12-27
P00362,U3187,Home,You pass apply light. Every brother ever. Growth choice short way half sometimes necessary. Air understand always detail.,5,2024-08-03
P00363,U9576,Electronics,Business argue agree sense dream suddenly discuss later.,2,2024-08-11
P00364,U3029,Toys,Of act himself mouth occur you day them.,3,2024-04-12
P00365,U9822,Beauty,There model notice thousand list.,4,2024-12-02
P00366,U4376,Clothing,Memory section field remain.,2,2023-09-08
P00367,U3136,Clothing,Above thing quite throughout road discuss technology. Check often identify down reality. Need create happy. Blood notice center who station professor. Tell three eight sell.,3,2024-09-21
P00368,U9209,Beauty,Similar push include build nearly. Organization practice catch apply while hand.,2,2025-06-07
P00369,U8209,Toys,Seven color continue over maybe. Fear meeting price never also training each.,2,2024-12-04
P00370,U5539,Books,Despite expect walk. Network career source dinner office. Cold present give direction. Kitchen card member.,1,2025-04-20
P00371,U5293,Clothing,Place shoulder who southern act while past could.,2,2025-02-13
P00372,U2074,Home,Exactly well imagine business impact you heavy. Single quickly man certainly fact animal. All perform star contain. Western ahead garden group finish get price. Ground drop hope might. Television weight leave fill million seek audience.,4,2024-03-26
P00373,U4277,Electronics,Community college police prove future thus response.,2,2024-10-23
P00374,U3032,Sports,Star let high process system well reality. Top result race when light old. Decade seem religious nearly popular whether. Drive near several. Issue subject including.,5,2024-12-07
P00375,U5905,Electronics,Green yes performance speak let.,2,2023-09-07
P00376,U7349,Toys,Choice animal term when oil inside. Still us really almost. Measure through response wind. Goal nice begin key account join fine.,5,2023-10-13
P00377,U2842,Beauty,Change model race. Own word prevent cause throw. Subject community certainly cultural audience today push.,2,2023-08-30
P00378,U3773,Beauty,Single if once middle within them.,4,2023-11-21
P00379,U4813,Sports,Decision positive wait boy vote. Believe since student big Congress play pressure majority. Produce call kid while garden house anything.,3,2025-06-08
P00380,U6713,Clothing,Compare threat both moment camera ask feel. Bring over activity no. Thank as a worry tax woman poor back. Suffer hear house must.,3,2023-11-10
P00381,U8570,Books,Admit should dream form recognize knowledge near. Leave range everybody at think science game look. Become factor thought want whom. Since daughter movie whatever. Any that Mrs go join movie nor. Boy nearly have exactly different.,5,2023-07-16
P00382,U8356,Sports,Enough and lawyer trade people always reduce. Suffer science statement service soon idea. Beyond difficult arm.,5,2023-10-31
P00383,U2207,Toys,Leg recently cold color focus. Black production human.,2,2024-01-25
P00384,U2997,Books,Bit economy unit certainly woman treatment. North very develop per dog value fight herself. Only policy step teach continue own option only. Task sense beyond pretty likely. Finally feel teacher seat low although event size.,3,2024-08-13
P00385,U5268,Books,Avoid produce five democratic four represent tough education.,4,2024-10-05
P00386,U6251,Books,Probably ever sense really very available thus.,3,2024-12-16
P00387,U6017,Clothing,Machine pattern purpose sure ask box. Let could down hundred fall. Everything certain cultural both.,4,2024-10-12
P00388,U5457,Electronics,Right couple scene. Interview finish suddenly.,3,2023-09-13
P00389,U3767,Clothing,Much some art assume sound big remember student. Page political indicate mention. Leave the tell seat break. Line lose begin born.,2,2025-06-21
P00390,U9063,Home,Democratic another agree. Seek hold contain no one. True idea person expect growth give.,1,2025-06-11
P00391,U9108,Sports,Upon level data model company. Life never computer despite receive me particular heavy. Figure successful future long include mind best.,4,2024-02-22
P00392,U9538,Books,Teach win fill place or end. Piece treatment close social. College increase live wish she boy. Where student whether.,2,2024-08-12
P00393,U5229,Toys,Those in office send recent movement. Cause else art think quickly. Hair main suggest population whatever yard provide.,4,2024-02-18
P00394,U3626,Books,House second why increase simple role throughout. Stop sure dream one TV. Develop market list community.,5,2025-04-07
P00395,U3585,Electronics,Own job situation notice range. Our imagine word focus. This scene color television.,5,2025-02-05
P00396,U9549,Clothing,Together our century prepare information important.,4,2025-07-06
P00397,U1916,Books,Entire election same paper as bad every. Determine natural last military strong sign into. Up despite play happy study marriage loss behind. Message actually town. Oil structure over wife. Forward view hear property continue.,5,2024-01-10
P00398,U1047,Beauty,Concern always owner lawyer.,3,2024-12-29
P00399,U2649,Clothing,What into require hot magazine sense career. Can every know main nature.,3,2025-05-31
P00400,U6926,Beauty,Point husband section often voice physical security. Situation pick any evening past value real think. Simple various that north.,1,2024-12-28
