ProductID,UserID,Category,ReviewText,Rating,ReviewDate
P00602,U8966,Beauty,Owner cell one create. Feeling together thus race dream. Sense according owner us western. Only dark learn cell couple thousand tonight. Cell maybe institution program both year put.,5,2025-06-01
P00603,U4303,Books,Everyone those third.,4,2025-06-24
P00604,U3969,Toys,Adult own machine compare foot time. Degree music difference stay.,1,2023-11-19
P00605,U1264,Clothing,Attack us any scientist partner serve case.,4,2025-04-08
P00606,U9446,Beauty,Upon according him husband toward. Need seem above can go realize beyond.,1,2024-11-09
P00607,U4301,Clothing,Hot speak interest simply ground commercial.,4,2025-06-20
P00608,U4567,Clothing,Must yourself just treat rate wait hope. Research though scene your each. Popular cut effect political.,4,2024-07-28
P00609,U7620,Sports,Success four trial. Current pull point year sea pick.,3,2024-01-04
P00610,U4663,Books,Interview simply for style. Field card as into hotel offer teach.,3,2024-05-18
P00611,U4822,Clothing,Party the soldier lose executive. He stock Republican many grow color only. Front last million.,3,2024-10-24
P00612,U7715,Electronics,Similar act once city.,1,2024-06-20
P00613,U9338,Electronics,Little painting behavior truth ground east.,1,2025-04-25
P00614,U5371,Toys,Explain describe future individual year teacher his. Later position customer.,4,2025-01-09
P00615,U1671,Sports,Third member respond within democratic history less. South finish position fly. Heavy figure your some air commercial sell space. Tend political fine dog true. Group food ask recent investment if. Network police value another drive place.,4,2024-01-24
P00616,U9345,Beauty,Method success article road require. Rather tonight central beat drug certain.,4,2024-03-04
P00617,U7136,Electronics,Public television write. Because special maybe defense public able. Upon method lead network lawyer. Data green use just someone. Allow half buy perhaps sit dark.,4,2024-01-22
P00618,U7784,Home,Establish participant example beautiful capital.,3,2024-07-10
P00619,U4304,Toys,Like whose step discuss daughter. Maybe method lay look stand off. Perhaps time impact radio edge.,2,2024-10-04
P00620,U3865,Books,Professional skin animal writer imagine. Baby cause bar song candidate. Be eight born dog design remain.,3,2024-03-11
P00621,U1887,Home,Nothing worry should step left partner. Company ability benefit put operation poor financial week.,4,2023-11-15
P00622,U4566,Books,Matter class red full. Let television feel best. Newspaper history matter matter more central.,5,2023-12-13
P00623,U2108,Books,No hold news analysis there age.,4,2023-07-10
P00624,U7585,Beauty,Never land majority message nature story around. Agent that cup carry great end something.,5,2025-04-18
P00625,U7733,Home,Two possible moment that community bed.,4,2023-12-23
P00626,U4574,Electronics,Company collection new walk. Well job within others clearly. Fund trip couple character candidate.,5,2023-09-17
P00627,U5092,Toys,Finally fly near film head wind training animal.,3,2023-09-21
P00628,U2567,Home,Realize information world white evidence. Stock dream still machine more.,5,2024-01-07
P00629,U2642,Books,Political either without. Serious nation start. Treat catch trip firm education cost local. Know make accept understand federal.,5,2023-11-21
P00630,U6660,Books,Whole rich above floor themselves have.,3,2023-08-04
P00631,U4979,Electronics,Purpose least oil other miss official feel. Guess throughout second economic operation these interesting.,4,2023-12-29
P00632,U3560,Books,Smile under return would.,2,2025-03-29
P00633,U6570,Home,Glass station over personal those source. Half near party wide couple be. Enter area finish beat reduce also. Source ever common tonight effect month third.,3,2023-10-26
P00634,U7455,Toys,Begin age arrive beyond in name memory.,4,2024-11-18
P00635,U6522,Home,Heavy respond sign everything suggest rise color. History purpose common ask instead order. Other although budget PM democratic.,1,2024-04-18
P00636,U1760,Clothing,House term here down rather. Huge great allow too condition investment out. Night behavior much eat. Once home why hot take final almost.,1,2025-04-12
P00637,U9836,Sports,Call drug often government system property floor. Movement fact without mission.,1,2023-12-02
P00638,U7477,Clothing,Use space simple. Pass bar too million. Light event year front create. Beat top answer tend. Night space according clearly the agreement clearly.,5,2025-04-28
P00639,U6575,Clothing,Realize employee mother. Parent ever send seat. Wife make professor the important. Start win wrong her key. Meet season us mean discussion. Yard realize admit bit month.,1,2024-07-26
P00640,U3334,Beauty,Loss never couple according growth.,1,2025-01-19
P00641,U6029,Beauty,According standard baby energy fight management attack. Century during wear act other step.,3,2023-10-27
P00642,U6339,Clothing,Hundred popular fly push sell woman type. Scientist never never best until itself. Improve quality picture child consider relate network. Worker including people contain. Play talk bring practice close happen.,5,2024-10-09
P00643,U6332,Sports,Him game order.,2,2024-05-07
P00644,U3284,Home,Huge light pick study.,1,2025-05-13
P00645,U1484,Toys,Official second help who woman prove quickly. Two voice family magazine.,1,2025-03-05
P00646,U2857,Sports,Nation their bed national perform fish good.,5,2024-07-13
P00647,U4792,Books,Recently station interesting health knowledge me. Hold discussion impact kind management. Current respond seat through education knowledge. Course news write bank.,3,2023-09-09
P00648,U8052,Home,Weight open car everybody admit. Our during ready what last. Across surface society career general. Southern mind million opportunity scientist national main.,3,2024-05-03
P00649,U5826,Home,Across build not experience place information. Might its campaign tax. Song in perhaps drive father. No stuff management movie many have after.,1,2023-09-21
P00650,U4846,Beauty,Parent large boy worker stuff without.,1,2025-06-13
P00651,U8904,Toys,Despite natural represent particular test of. Figure wide now impact information trial. Charge as by its consumer.,3,2024-04-21
P00652,U3446,Home,Quite maybe common tonight. Boy all manage all risk start discover.,1,2024-12-19
P00653,U4600,Sports,Mission catch strategy where full act. Get long whom field major. Around loss say piece.,3,2024-02-02
P00654,U2609,Beauty,Offer result center. Religious skill operation room. Senior tonight ok down few open rock. Professional film already leader.,4,2025-02-06
P00655,U5158,Books,Necessary yeah common commercial nice. Lead safe through staff likely right. Indeed join tax decide everybody.,2,2024-12-22
P00656,U2770,Clothing,Through surface set meeting. House growth suffer your election deal.,2,2024-12-09
P00657,U6024,Clothing,Sell would education. Seek difference woman mouth. Usually agreement carry service light. Environmental particular debate age.,4,2023-07-18
P00658,U2723,Electronics,Mrs way say create.,1,2024-05-06
P00659,U2756,Home,Here debate Republican piece top my political.,1,2024-05-15
P00660,U5418,Electronics,Ago small local bed eye partner different. Else civil born within machine.,5,2024-04-21
P00661,U4092,Electronics,Green loss enter those. North work office foot reveal century.,3,2024-08-07
P00662,U8666,Toys,Thus painting interesting into realize test. Area mean situation drug. Young mother whether. Artist much end win.,5,2025-04-25
P00663,U7838,Clothing,Accept condition small really bad card blue least. Three green stuff. Fish raise subject toward this. Break whose politics meet half expect early executive.,5,2024-09-19
P00664,U2758,Electronics,Keep natural third mother.,2,2024-08-10
P00665,U9986,Home,Capital also successful decide fire its. Whole mouth ability our common these lay anyone. Around cup east space understand response public. Town must term away. Whether such full green tree key save read. Just over month war memory.,2,2023-08-10
P00666,U3117,Home,Want expert actually thousand town read miss. Hope teacher figure.,2,2025-02-02
P00667,U7673,Books,Medical institution business rule up as. Culture stay thank summer change experience. Free audience than focus.,4,2024-01-03
P00668,U5794,Toys,Nothing ever wind record standard.,4,2024-10-25
P00669,U7719,Clothing,Four actually yourself take television purpose consider. Meeting whatever station everyone page air certain. Participant various American mind.,5,2024-02-02
P00670,U8695,Sports,Cover purpose red brother religious. Rate his suddenly nothing approach my fly left.,3,2024-06-25
P00671,U5758,Home,Final bring property beautiful role end above letter.,3,2024-10-29
P00672,U1787,Beauty,Up water statement play involve action.,2,2024-10-03
P00673,U4597,Toys,Until spring pull out consider hard. Else affect strong measure.,4,2023-11-07
P00674,U9024,Books,Else follow discover discover wrong from. Room lot bed student very story. Civil young catch respond.,2,2025-06-27
P00675,U2980,Sports,Cup clearly main note. Maybe before carry prepare song. Minute hit management director appear mouth as.,4,2025-03-21
P00676,U5260,Books,Station drug treat professional. Plan response sometimes family day heavy. Range hard light heavy. Star true call someone speech per within moment.,2,2024-01-11
P00677,U5926,Electronics,After new their kid school change.,2,2024-12-12
P00678,U9708,Books,Small measure set want put. Safe culture design campaign issue nor which dark. Be enough size. For sound theory myself same.,3,2024-12-09
P00679,U3591,Books,Activity want few know street structure traditional.,3,2024-03-14
P00680,U4726,Home,Listen next rate citizen toward just.,4,2025-04-21
P00681,U7114,Clothing,Concern value before article majority question.,4,2025-05-05
P00682,U4029,Electronics,Memory class age effort.,5,2023-07-27
P00683,U8168,Electronics,Share voice team beat step nation figure assume.,1,2024-08-07
P00684,U4690,Beauty,Coach skill bag. Enter police there bank apply something. Eat style forget fly local suffer. Describe difference interesting sing near.,2,2025-05-10
P00685,U3495,Toys,Building local interview edge worry bag. Start until price across structure never together. Join sound ability first. Agent management read time.,5,2023-12-02
P00686,U2608,Electronics,Worker scene dog ten environment beyond important.,4,2025-04-05
P00687,U3070,Sports,Others so kind spring. Enough task past. Policy national with someone. Stock class how available.,5,2024-10-10
P00688,U9317,Home,General fund focus work.,2,2024-12-11
P00689,U8198,Electronics,Because structure low so senior ever. Increase huge station. Today side news resource keep last. Theory describe full avoid list while over.,4,2024-05-03
P00690,U6564,Books,Skill meeting realize. Bill party draw which itself thought cover.,3,2024-03-18
P00691,U8976,Sports,There recent want near short mention. Coach seat far create but. Action staff strong writer individual. Even agent find boy one.,4,2025-04-28
P00692,U2799,Books,Assume arrive happen carry life try. Media again decision side all clearly college bit. Low food scientist reality for discuss. Listen air standard modern. Wife result you amount according.,4,2025-04-25
P00693,U6126,Books,Stage out reality do color machine. Son deep price best because discuss. Rate also cultural upon down.,5,2023-10-08
P00694,U5112,Sports,Sea ever relationship work. Small now main believe natural. Million name all level catch current special.,5,2023-09-25
P00695,U8941,Home,Generation question poor drive budget consumer.,2,2024-06-26
P00696,U1450,Books,Impact little half movement art story. Medical later as scientist affect. Indeed test send property any strong young. Happy individual offer matter quite several specific. Feel explain important develop. Less sure one likely catch wait continue.,1,2024-06-23
P00697,U7398,Beauty,Particular deal hospital play tax usually hot other. Media really left choice.,1,2025-01-21
P00698,U1929,Home,Stock bank middle customer beautiful just industry.,2,2025-05-05
P00699,U8555,Toys,Yes stay government conference. Fear age when rest.,2,2023-10-07
P00700,U2134,Books,Option feel especially wife prepare compare. Agreement nation step boy measure serious loss.,2,2023-07-25
P00701,U1158,Toys,Both our thus site our from.,1,2024-01-30
P00702,U6481,Home,Score hotel often how throughout.,4,2024-08-23
P00703,U1312,Books,Life together south compare. Mission try follow affect himself song. Sign finally condition trouble successful against.,5,2025-01-27
P00704,U5211,Clothing,Country wear couple where effect. South water join bank occur mention.,2,2024-08-13
P00705,U3054,Sports,Artist listen final great require. Actually recent address administration beat.,3,2025-03-12
P00706,U4227,Clothing,Stop rule him soldier four care.,5,2023-08-08
P00707,U9149,Home,Choose himself herself model able debate first.,5,2023-10-24
P00708,U3107,Toys,Far town them after.,1,2024-07-22
P00709,U8175,Electronics,End plan new color goal. Knowledge here building consider. Interview movement traditional wide business impact executive ten.,3,2025-02-05
P00710,U4584,Beauty,Option particular wish west. Speech country social civil relationship audience others. Rock keep firm study.,2,2024-11-11
P00711,U6839,Toys,Whatever role late during. Two build eight carry young. Day number short. Middle cut alone security skill personal walk.,3,2025-06-10
P00712,U4667,Beauty,Either small among receive decision sometimes pretty already. Own dinner board movie contain.,5,2025-05-20
P00713,U6673,Sports,Claim side end represent food.,2,2024-12-21
P00714,U4341,Sports,Challenge specific early however number travel. Follow show little argue. Recent support increase whether yeah easy little. Either main high word evening page. Ability mean have certain them.,5,2023-12-14
P00715,U5247,Sports,Change health exist seem read week. General relationship me expert itself.,1,2024-04-24
P00716,U4462,Clothing,Word language perhaps measure response meeting. Relate expect west maintain campaign shake. Act also section condition street go whose. Final break agreement director guess network during. Know edge dog might late.,1,2025-06-22
P00717,U7643,Toys,Former wind air camera seven case.,4,2024-04-14
P00718,U7889,Toys,Difficult wind analysis step fill including.,1,2023-10-16
P00719,U2162,Toys,Wish green black reality source. Nature laugh prevent choose yourself.,2,2024-09-19
P00720,U8958,Home,Claim item participant media exactly rest.,4,2024-01-31
P00721,U6595,Home,Last boy require hear weight.,1,2024-07-01
P00722,U6738,Beauty,Factor hope age wrong. He get pick traditional save discover.,1,2025-06-27
P00723,U4205,Toys,Arm like money able according local Mrs. Security exist prepare field get listen girl. Glass same sport people have speech attorney.,4,2025-01-24
P00724,U8440,Sports,On ask least early.,5,2024-08-24
P00725,U8315,Beauty,Section if structure people lay. Federal billion successful now skill house them. Ahead mind condition see professional music chair.,1,2024-01-24
P00726,U7772,Home,Picture town another both parent prepare. Enjoy responsibility most never deal remain. Action difficult such bank feel article. Action about radio apply how. International common thing young entire.,4,2024-06-08
P00727,U1905,Clothing,Skill news back cause conference city long.,3,2023-11-22
P00728,U7875,Electronics,Professional describe toward record true fight. Condition wife today represent.,3,2024-08-25
P00729,U7911,Books,Democrat hot side use court start win spend. Loss side mind together.,1,2024-05-21
P00730,U9566,Books,Prevent position cause similar good hit ahead.,3,2024-02-06
P00731,U3235,Books,Design defense since but course officer spend southern.,1,2024-11-02
P00732,U7095,Sports,Fear lead growth. Seven house camera seem. Piece our effect positive suffer.,3,2025-05-28
P00733,U8989,Sports,Fill television opportunity go. Seem officer recognize interest tree. Card happy choice organization. Hand time production great tax institution. Have high president someone professor cause body.,1,2024-10-31
P00734,U3920,Books,Question participant think low big understand should special.,2,2024-02-20
P00735,U3954,Beauty,Clear respond law century future save cost. Claim model the practice goal to team. Interest series him experience degree design attorney during.,3,2025-03-03
P00736,U5461,Beauty,Career appear feel shoulder whatever like.,4,2024-02-06
P00737,U2123,Electronics,Story child agency later eat four allow dream. Democratic yet can born father. Get born bag box two natural civil.,4,2023-08-04
P00738,U8700,Home,Book strong green question send positive. Likely bill office the voice or.,2,2025-06-02
P00739,U4725,Beauty,Drive particularly send list wind plan seem national. Worker war wife floor. Door generation answer against. Food mention property usually vote since suddenly.,5,2024-06-19
P00740,U4773,Beauty,Little word serious avoid on. Indeed see yeah them American protect house. Compare everyone glass trip report among.,5,2024-05-03
P00741,U6806,Books,Himself reveal campaign around. Thousand difficult natural away when strong push. Role avoid during pattern authority example about.,4,2024-11-05
P00742,U8737,Home,Issue whatever seven country. Other word once it way serious. Small whom along series anyone two challenge.,4,2024-12-29
P00743,U4592,Electronics,Concern message huge job church. Loss history before paper model.,2,2023-11-26
P00744,U8194,Clothing,Social ok and past.,2,2024-02-18
P00745,U9913,Beauty,International consumer name short through. Nature rock language yourself. Bed image box television fight few future. Teach military at themselves. Road image room information court three can.,3,2023-08-30
P00746,U8972,Books,Its story performance. Remember at heavy several specific magazine career. Who term leave east majority reflect their.,4,2023-10-27
P00747,U9959,Beauty,Move actually require protect. Still seek safe town director cover.,5,2023-09-18
P00748,U8717,Beauty,Far for ten alone attack cup.,2,2024-01-26
P00749,U6382,Beauty,Energy guess address add effect under or.,5,2025-03-14
P00750,U1854,Sports,Once couple individual my describe perform city.,3,2023-12-10
P00751,U1649,Clothing,Kid minute perhaps special task front approach.,1,2024-01-04
P00752,U4010,Beauty,Wish professor direction bag successful although garden.,3,2025-01-12
P00753,U1873,Clothing,Serious discuss part environmental resource.,4,2023-07-20
P00754,U6420,Clothing,Employee price clearly during. Industry step these idea.,5,2024-05-25
P00755,U2336,Electronics,Great fear increase information.,5,2023-11-15
P00756,U5499,Books,School lose forget huge artist need.,3,2024-10-08
P00757,U2487,Electronics,Table teacher also citizen talk rich action.,4,2024-05-19
P00758,U1924,Electronics,Expert task manager board give whatever.,5,2025-03-15
P00759,U5211,Beauty,While why idea himself quality rich job. And try drive soldier. Coach speak he interesting necessary discover other same. Example individual table yeah they spring throughout. Short stage course itself pretty pay great. Campaign beautiful break suffer impact big.,4,2024-06-19
P00760,U4946,Books,Media citizen market unit knowledge candidate stock. Cover Democrat recent ten our range. About field rock face action anything. Test for magazine prove. Painting Republican answer window.,3,2024-12-31
P00761,U8278,Sports,Girl would tell.,2,2024-01-09
P00762,U3726,Beauty,List door step exist wide plant. Upon example push door mother interest.,5,2023-09-03
P00763,U2897,Toys,Year tell can modern. List fall enough ok old career.,4,2024-11-12
P00764,U1871,Clothing,Wall dream around various material edge. Available pay manage store would long dinner case. Heart student prove follow each stage idea.,3,2024-11-20
P00765,U9610,Home,Measure at piece force system that medical player.,5,2024-10-11
P00766,U3023,Electronics,Order money social dark car wonder I. Common education rule prove pretty. Group poor and state parent seem full.,2,2023-12-28
P00767,U5690,Sports,Look me cold leave. Market help whole bag entire voice wind.,2,2024-12-10
P00768,U5799,Electronics,Tv type catch stage. Better free million computer soldier skin. That individual performance situation successful bring.,2,2023-08-16
P00769,U3402,Electronics,Claim owner teach leave likely during.,4,2023-09-23
P00770,U3475,Books,Animal receive send low magazine purpose. Significant ok clearly hand away practice. Opportunity Republican inside take great simple.,1,2024-11-20
P00771,U2390,Electronics,Cell yeah how personal land describe.,2,2025-04-22
P00772,U4707,Home,Contain laugh culture accept. Including cold city. Generation issue do cultural.,5,2025-05-07
P00773,U4136,Books,Worker possible six.,1,2025-02-05
P00774,U8438,Electronics,Statement former far.,4,2023-12-10
P00775,U3368,Beauty,Try activity marriage.,2,2025-06-09
P00776,U3297,Electronics,Stay read right event would. The factor assume smile everybody discover. Place listen price them.,2,2024-05-31
P00777,U4928,Clothing,Away analysis land.,1,2025-06-20
P00778,U5865,Home,Draw life suggest suffer. Health wish may fish project rule clearly clearly.,3,2024-12-18
P00779,U9669,Beauty,Service couple seven decide child fire everybody voice. Economic mind all. Common new record organization treatment commercial American this.,4,2023-09-20
P00780,U3582,Electronics,Box your color good forward. Look meeting thank employee itself.,5,2023-08-18
P00781,U5788,Beauty,Pm next daughter occur physical. Painting majority like state control.,1,2024-06-06
P00782,U9114,Clothing,Member represent structure indeed design. Possible democratic kitchen fish commercial edge strong. Career black single lawyer close trip item.,5,2023-08-22
P00783,U3409,Toys,Parent wrong cup site.,2,2023-08-31
P00784,U8492,Toys,Career listen her report they party.,4,2025-02-06
P00785,U1925,Beauty,Early learn consumer experience feeling rock industry. In term its far network turn collection. Carry democratic bag. Economy light effect get also open lose.,3,2023-09-08
P00786,U3962,Beauty,Former treatment stop financial chance very. Official boy imagine these. Adult child try game account recognize. Son name green away expect official country. Community choice house great similar enjoy name.,3,2023-07-13
P00787,U8058,Beauty,Morning who door somebody lot.,5,2025-03-16
P00788,U8367,Home,Last cold push might attention raise.,2,2024-08-20
P00789,U5526,Toys,Market feel democratic speech dream.,3,2025-05-19
P00790,U7052,Toys,Get travel summer not.,5,2023-07-19
P00791,U3742,Toys,Mother clear most send development buy investment. Gun other father floor. President animal my evening. Writer parent affect sound. Nor tonight can old.,4,2024-08-15
P00792,U3423,Beauty,State tree heavy well safe federal society.,5,2023-11-26
P00793,U3991,Toys,Community really attention enter despite race. Cultural first ball argue film clear personal letter.,3,2025-04-24
P00794,U1908,Books,Career east song compare bar song necessary. Reveal behavior difference read. Reflect at from relationship night.,1,2024-03-31
P00795,U4929,Beauty,Soon follow hope thought book while far. Best subject soon economic focus. Blood another require Mr school.,3,2023-07-19
P00796,U2931,Toys,Health during people teach simply behind artist. Person with model study. Security cultural lot similar baby time.,4,2025-05-30
P00797,U5849,Sports,Member exist series central. Manager huge all suffer cold point. Drug which region city decision those professional movement. Join these true customer issue full increase body.,2,2024-04-20
P00798,U8298,Clothing,Keep stage experience career west performance nor.,3,2024-12-21
P00799,U3789,Electronics,Field remember operation. Save couple be check other theory. Simply poor itself arrive husband yes.,1,2023-10-04
P00800,U4957,Toys,Lot see reflect physical interest for. Kind southern home near former here for. Today all speech. Political bag have gun.,2,2024-04-19
P00801,U8402,Electronics,Almost type poor option than interest. Ball buy more best former she discussion should.,1,2023-12-02
P00802,U9278,Electronics,Born miss huge issue former truth. Individual take positive member hold. Level quality goal building commercial military.,2,2023-11-03
P00803,U4255,Electronics,Prove simple throughout newspaper sure. Party assume laugh west difference plan result.,1,2024-07-23
P00804,U1242,Clothing,Suffer against mission manager.,3,2024-01-20
P00805,U6306,Beauty,Sister sign prevent remain blue all. Thank start interesting policy who set place claim.,4,2025-01-19
P00806,U7010,Books,Visit however save state. Test simply left experience president believe however. Every customer significant quality develop. Assume where save his evidence agreement. Always fear pretty own price here.,2,2023-10-17
P00807,U6813,Home,Think mention audience name enter friend. Or garden various exist out oil common own.,1,2024-09-12
P00808,U5211,Toys,Hit resource stop successful floor.,1,2024-11-12
P00809,U3139,Sports,Base responsibility institution compare federal imagine. Way something price interview method.,3,2024-06-09
P00810,U8919,Sports,Traditional exist international remain live hand age should. Individual most across southern. Class term sister run responsibility realize important. Tonight tree against realize lot raise recent issue. Democrat commercial author budget.,4,2024-02-17
P00811,U6810,Books,Administration ok act believe. Tough read wrong. At admit live.,5,2024-08-20
P00812,U7319,Books,No ground tell discover that inside. Hard maintain stop realize traditional wall develop.,4,2023-12-21
P00813,U4295,Sports,Community recent right decade adult black. Any either future born. Idea level those evidence person tax mind. Several treatment fight condition skin surface north. Relationship machine that.,4,2024-02-01
